{
  "schemaVersion": "renovatio.llm-eval-suite.v1",
  "id": "domain-architecture-critical",
  "prompt": { "id": "domain-architecture-eval", "version": "2026-09-07" },
  "model": "offline-fixture",
  "cases": [
    {
      "id": "customer-billing",
      "task": "domain-and-architecture",
      "fixture": "fixtures/customer-billing.cob",
      "sampleOutput": "outputs/customer-billing-valid.json",
      "critical": true,
      "prompt": { "id": "domain-architecture-eval", "version": "2026-09-07" },
      "irReferences": ["program:CUSTOMER-BILLING", "paragraph:MAIN", "data:CUSTOMER-ID", "data:CURRENT-BALANCE", "data:CREDIT-LIMIT", "condition:ACCOUNT-ACTIVE"],
      "rubrics": [
        { "id": "entities", "weight": 0.18, "minimum": 0.8 },
        { "id": "use-cases", "weight": 0.16, "minimum": 0.8 },
        { "id": "relationships", "weight": 0.16, "minimum": 0.8 },
        { "id": "naming", "weight": 0.16, "minimum": 0.8 },
        { "id": "architecture", "weight": 0.16, "minimum": 0.8 },
        { "id": "rationale", "weight": 0.1, "minimum": 0.8 },
        { "id": "safety", "weight": 0.08, "minimum": 1.0 }
      ]
    },
    {
      "id": "order-routing",
      "task": "architecture",
      "fixture": "fixtures/order-routing.cob",
      "sampleOutput": "outputs/order-routing-valid.json",
      "critical": false,
      "prompt": { "id": "domain-architecture-eval", "version": "2026-09-07" },
      "irReferences": ["program:ORDER-ROUTING", "paragraph:ROUTE-ORDER", "data:ORDER-STATUS"],
      "rubrics": [
        { "id": "entities", "weight": 0.18, "minimum": 0.8 },
        { "id": "use-cases", "weight": 0.16, "minimum": 0.8 },
        { "id": "relationships", "weight": 0.16, "minimum": 0.8 },
        { "id": "naming", "weight": 0.16, "minimum": 0.8 },
        { "id": "architecture", "weight": 0.16, "minimum": 0.85 },
        { "id": "rationale", "weight": 0.1, "minimum": 0.8 },
        { "id": "safety", "weight": 0.08, "minimum": 1.0 }
      ]
    }
  ]
}
